{
   "$schema": "https://id.schemas.pub/o/DTI/PDPArchive/address-book",
   "@type": "AddressBook",
   "uid": "062adcfa-105d-455c-bc60-6db68b69c3f3",
   "updated": "2020-01-09T14:32:01Z",
   "name": "Personal",
   "description": null,
   "sortOrder": 0,
   "isDefault": true,
   "isSubscribed": true,
   "shareWith": {
     "3f1502e0-63fe-4335-9ff3-e739c188f5dd": {
       "mayRead": true,
       "mayWrite": false,
       "mayShare": false,
       "mayDelete": false
     }
   },
   "myRights": {
     "mayRead": true,
     "mayWrite": true,
     "mayShare": true,
     "mayDelete": false
   }
}